{
  "id": "https://geolabs.github.io/bblocks-generic-profiles/def/implementation-profile/topographic-position-index",
  "type": "ImplementationProfile",
  "prefLabel": "Topographic position index",
  "definition": "The topographic position index (TPI) of Guisan et al. (1999): the difference between the elevation of each cell and the mean elevation of its neighbourhood.",
  "inScheme": "https://geolabs.github.io/bblocks-generic-profiles/def/implementation-profile",
  "status": "submitted",
  "refinesGenericProfile": "https://geolabs.github.io/bblocks-generic-profiles/def/generic-profile/terrain-derivative",
  "keywords": [
    "terrain",
    "elevation",
    "raster",
    "derivative",
    "TPI",
    "ta_morphometry"
  ],
  "metadata": [
    {
      "title": "Process Concept: Terrain Analysis",
      "role": "http://www.opengis.net/spec/wps/2.0/def/process-profile/concept",
      "href": "https://geolabs.github.io/bblocks-generic-profiles/def/concept/terrain-analysis"
    },
    {
      "title": "Generic Profile: Terrain derivative",
      "role": "http://www.opengis.net/spec/wps/2.0/def/process-profile/generic",
      "href": "https://geolabs.github.io/bblocks-generic-profiles/def/generic-profile/terrain-derivative"
    }
  ],
  "inputs": {
    "elevation": {
      "id": "https://geolabs.github.io/bblocks-generic-profiles/def/implementation-profile/topographic-position-index/inputs/elevation",
      "dataType": "https://geolabs.github.io/bblocks-generic-profiles/def/data-type/elevation-model",
      "schema": {
        "type": "string",
        "contentEncoding": "base64",
        "contentMediaType": "image/tiff",
        "description": "GeoTIFF"
      },
      "keywords": [
        "elevation",
        "GeoTIFF"
      ],
      "metadata": [
        {
          "title": "Generic Profile: Terrain derivative -- input `elevation`",
          "role": "https://geolabs.github.io/bblocks-generic-profiles/def/role/generic-input",
          "href": "https://geolabs.github.io/bblocks-generic-profiles/def/generic-profile/terrain-derivative/inputs/elevation"
        }
      ]
    }
  },
  "outputs": {
    "result": {
      "id": "https://geolabs.github.io/bblocks-generic-profiles/def/implementation-profile/topographic-position-index/outputs/result",
      "dataType": "https://geolabs.github.io/bblocks-generic-profiles/def/data-type/raster-single-band",
      "schema": {
        "type": "string",
        "contentEncoding": "base64",
        "contentMediaType": "image/tiff",
        "description": "GeoTIFF"
      },
      "keywords": [
        "raster",
        "GeoTIFF"
      ],
      "metadata": [
        {
          "title": "Generic Profile: Terrain derivative -- output `result`",
          "role": "https://geolabs.github.io/bblocks-generic-profiles/def/role/generic-output",
          "href": "https://geolabs.github.io/bblocks-generic-profiles/def/generic-profile/terrain-derivative/outputs/result"
        }
      ]
    }
  },
  "source": [
    {
      "title": "SAGA 7.3.0 -- Topographic Position Index (TPI)",
      "link": "https://saga-gis.sourceforge.io/saga_tool_doc/7.3.0/ta_morphometry_18.html"
    },
    {
      "title": "ZOO-Project Geonovum testbed -- SAGA.ta_morphometry.18: Topographic Position Index (TPI)",
      "link": "https://host1.tb.geonovum.geolabs.fr/ogc-api/processes/SAGA.ta_morphometry.18"
    },
    {
      "title": "Guisan, A., Weiss, S.B., Weiss, A.D. (1999): GLM versus CCA spatial modeling of plant species distribution. Plant Ecology 143: 107-122"
    }
  ]
}