{
  "id": "https://geolabs.github.io/bblocks-generic-profiles/def/implementation-profile/raster-band-math-multiband",
  "type": "ImplementationProfile",
  "prefLabel": "Raster band math (multi-band output)",
  "definition": "Evaluates a user-supplied, possibly vector-valued mathematical expression per pixel across one or more input rasters, producing an output raster with one or more bands.",
  "inScheme": "https://geolabs.github.io/bblocks-generic-profiles/def/implementation-profile",
  "status": "submitted",
  "refinesGenericProfile": "https://geolabs.github.io/bblocks-generic-profiles/def/generic-profile/raster-band-math",
  "keywords": [
    "raster",
    "coverage",
    "band math",
    "OTB",
    "BandMathX",
    "multi-band"
  ],
  "metadata": [
    {
      "title": "Process Concept: Raster Coverage Processing",
      "role": "http://www.opengis.net/spec/wps/2.0/def/process-profile/concept",
      "href": "https://geolabs.github.io/bblocks-generic-profiles/def/concept/raster-coverage-processing"
    },
    {
      "title": "Generic Profile: Raster band math",
      "role": "http://www.opengis.net/spec/wps/2.0/def/process-profile/generic",
      "href": "https://geolabs.github.io/bblocks-generic-profiles/def/generic-profile/raster-band-math"
    }
  ],
  "inputs": {
    "rasters": {
      "id": "https://geolabs.github.io/bblocks-generic-profiles/def/implementation-profile/raster-band-math-multiband/inputs/rasters",
      "dataType": "https://geolabs.github.io/bblocks-generic-profiles/def/data-type/raster",
      "schema": {
        "type": "string",
        "contentEncoding": "base64",
        "contentMediaType": "image/tiff",
        "description": "GeoTIFF"
      },
      "maxOccurs": "unbounded",
      "keywords": [
        "raster",
        "GeoTIFF"
      ],
      "metadata": [
        {
          "title": "Generic Profile: Raster band math -- input `rasters`",
          "role": "https://geolabs.github.io/bblocks-generic-profiles/def/role/generic-input",
          "href": "https://geolabs.github.io/bblocks-generic-profiles/def/generic-profile/raster-band-math/inputs/rasters"
        }
      ]
    },
    "expression": {
      "id": "https://geolabs.github.io/bblocks-generic-profiles/def/implementation-profile/raster-band-math-multiband/inputs/expression",
      "dataType": "https://geolabs.github.io/bblocks-generic-profiles/def/data-type/string",
      "keywords": [
        "expression"
      ],
      "metadata": [
        {
          "title": "Generic Profile: Raster band math -- input `expression`",
          "role": "https://geolabs.github.io/bblocks-generic-profiles/def/role/generic-input",
          "href": "https://geolabs.github.io/bblocks-generic-profiles/def/generic-profile/raster-band-math/inputs/expression"
        }
      ]
    }
  },
  "outputs": {
    "raster": {
      "id": "https://geolabs.github.io/bblocks-generic-profiles/def/implementation-profile/raster-band-math-multiband/outputs/raster",
      "dataType": "https://geolabs.github.io/bblocks-generic-profiles/def/data-type/raster",
      "schema": {
        "type": "string",
        "contentEncoding": "base64",
        "contentMediaType": "image/tiff",
        "description": "GeoTIFF"
      },
      "keywords": [
        "raster",
        "GeoTIFF"
      ],
      "metadata": [
        {
          "title": "Generic Profile: Raster band math -- output `raster`",
          "role": "https://geolabs.github.io/bblocks-generic-profiles/def/role/generic-output",
          "href": "https://geolabs.github.io/bblocks-generic-profiles/def/generic-profile/raster-band-math/outputs/raster"
        }
      ]
    }
  },
  "source": [
    {
      "title": "OGC 08-068r2 Web Coverage Processing Service (WCPS) Language Interface Standard",
      "link": "https://www.ogc.org/standards/wcps/"
    },
    {
      "title": "OTB BandMathX -- Performs mathematical operations on several multiband images, outputting a mono- or multi-band image",
      "link": "https://www.orfeo-toolbox.org/CookBook/Applications/app_BandMathX.html"
    },
    {
      "title": "OGC 09-146r8 Coverage Implementation Schema (CIS) 1.1.1, \u00a76.5 RangeType",
      "link": "https://docs.ogc.org/is/09-146r8/09-146r8.html"
    }
  ]
}
