{
  "id": "https://geolabs.github.io/bblocks-generic-profiles/def/implementation-profile/terrain-ruggedness-index",
  "type": "ImplementationProfile",
  "prefLabel": "Terrain ruggedness index",
  "definition": "The terrain ruggedness index (TRI) of Riley et al. (1999): how much the elevation of each cell differs from that of its neighbourhood.",
  "inScheme": "https://geolabs.github.io/bblocks-generic-profiles/def/implementation-profile",
  "status": "submitted",
  "refinesGenericProfile": "https://geolabs.github.io/bblocks-generic-profiles/def/generic-profile/terrain-derivative",
  "keywords": [
    "terrain",
    "elevation",
    "raster",
    "derivative",
    "TRI",
    "ta_morphometry"
  ],
  "metadata": [
    {
      "title": "Process Concept: Terrain Analysis",
      "role": "http://www.opengis.net/spec/wps/2.0/def/process-profile/concept",
      "href": "https://geolabs.github.io/bblocks-generic-profiles/def/concept/terrain-analysis"
    },
    {
      "title": "Generic Profile: Terrain derivative",
      "role": "http://www.opengis.net/spec/wps/2.0/def/process-profile/generic",
      "href": "https://geolabs.github.io/bblocks-generic-profiles/def/generic-profile/terrain-derivative"
    }
  ],
  "inputs": {
    "elevation": {
      "id": "https://geolabs.github.io/bblocks-generic-profiles/def/implementation-profile/terrain-ruggedness-index/inputs/elevation",
      "dataType": "https://geolabs.github.io/bblocks-generic-profiles/def/data-type/elevation-model",
      "schema": {
        "type": "string",
        "contentEncoding": "base64",
        "contentMediaType": "image/tiff",
        "description": "GeoTIFF"
      },
      "keywords": [
        "elevation",
        "GeoTIFF"
      ],
      "metadata": [
        {
          "title": "Generic Profile: Terrain derivative -- input `elevation`",
          "role": "https://geolabs.github.io/bblocks-generic-profiles/def/role/generic-input",
          "href": "https://geolabs.github.io/bblocks-generic-profiles/def/generic-profile/terrain-derivative/inputs/elevation"
        }
      ]
    }
  },
  "outputs": {
    "result": {
      "id": "https://geolabs.github.io/bblocks-generic-profiles/def/implementation-profile/terrain-ruggedness-index/outputs/result",
      "dataType": "https://geolabs.github.io/bblocks-generic-profiles/def/data-type/raster-single-band",
      "schema": {
        "type": "string",
        "contentEncoding": "base64",
        "contentMediaType": "image/tiff",
        "description": "GeoTIFF"
      },
      "keywords": [
        "raster",
        "GeoTIFF"
      ],
      "metadata": [
        {
          "title": "Generic Profile: Terrain derivative -- output `result`",
          "role": "https://geolabs.github.io/bblocks-generic-profiles/def/role/generic-output",
          "href": "https://geolabs.github.io/bblocks-generic-profiles/def/generic-profile/terrain-derivative/outputs/result"
        }
      ]
    }
  },
  "source": [
    {
      "title": "SAGA 7.3.0 -- Terrain Ruggedness Index (TRI)",
      "link": "https://saga-gis.sourceforge.io/saga_tool_doc/7.3.0/ta_morphometry_16.html"
    },
    {
      "title": "ZOO-Project Geonovum testbed -- SAGA.ta_morphometry.16: Terrain Ruggedness Index (TRI)",
      "link": "https://host1.tb.geonovum.geolabs.fr/ogc-api/processes/SAGA.ta_morphometry.16"
    },
    {
      "title": "Riley, S.J., De Gloria, S.D., Elliot, R. (1999): A Terrain Ruggedness that Quantifies Topographic Heterogeneity. Intermountain Journal of Science, Vol.5, No.1-4, pp.23-27"
    }
  ]
}