{
  "id": "https://geolabs.github.io/bblocks-generic-profiles/def/implementation-profile/buffer",
  "type": "ImplementationProfile",
  "prefLabel": "Buffer",
  "definition": "Returns a geometric object representing all points whose distance from this geometric object is less than or equal to a given distance.",
  "inScheme": "https://geolabs.github.io/bblocks-generic-profiles/def/implementation-profile",
  "status": "submitted",
  "refinesGenericProfile": "https://geolabs.github.io/bblocks-generic-profiles/def/generic-profile/geometry-buffer",
  "keywords": [
    "vector",
    "geometry",
    "spatial analysis",
    "buffer",
    "Buffer",
    "ST_Buffer"
  ],
  "metadata": [
    {
      "title": "Process Concept: Vector Geometry Processing",
      "role": "http://www.opengis.net/spec/wps/2.0/def/process-profile/concept",
      "href": "https://geolabs.github.io/bblocks-generic-profiles/def/concept/vector-geometry-processing"
    },
    {
      "title": "Generic Profile: Geometry buffer",
      "role": "http://www.opengis.net/spec/wps/2.0/def/process-profile/generic",
      "href": "https://geolabs.github.io/bblocks-generic-profiles/def/generic-profile/geometry-buffer"
    }
  ],
  "inputs": {
    "geometry": {
      "id": "https://geolabs.github.io/bblocks-generic-profiles/def/implementation-profile/buffer/inputs/geometry",
      "dataType": "https://geolabs.github.io/bblocks-generic-profiles/def/data-type/geometry",
      "schema": {
        "type": "string",
        "contentMediaType": "text/xml",
        "description": "GML"
      },
      "keywords": [
        "geometry",
        "GML"
      ],
      "metadata": [
        {
          "title": "Generic Profile: Geometry buffer -- input `geometry`",
          "role": "https://geolabs.github.io/bblocks-generic-profiles/def/role/generic-input",
          "href": "https://geolabs.github.io/bblocks-generic-profiles/def/generic-profile/geometry-buffer/inputs/geometry"
        }
      ]
    },
    "distance": {
      "id": "https://geolabs.github.io/bblocks-generic-profiles/def/implementation-profile/buffer/inputs/distance",
      "dataType": "https://geolabs.github.io/bblocks-generic-profiles/def/data-type/number",
      "keywords": [
        "distance"
      ],
      "metadata": [
        {
          "title": "Generic Profile: Geometry buffer -- input `distance`",
          "role": "https://geolabs.github.io/bblocks-generic-profiles/def/role/generic-input",
          "href": "https://geolabs.github.io/bblocks-generic-profiles/def/generic-profile/geometry-buffer/inputs/distance"
        }
      ]
    }
  },
  "outputs": {
    "result": {
      "id": "https://geolabs.github.io/bblocks-generic-profiles/def/implementation-profile/buffer/outputs/result",
      "dataType": "https://geolabs.github.io/bblocks-generic-profiles/def/data-type/surface",
      "schema": {
        "type": "string",
        "contentMediaType": "text/xml",
        "description": "GML"
      },
      "keywords": [
        "geometry",
        "GML"
      ],
      "metadata": [
        {
          "title": "Generic Profile: Geometry buffer -- output `result`",
          "role": "https://geolabs.github.io/bblocks-generic-profiles/def/role/generic-output",
          "href": "https://geolabs.github.io/bblocks-generic-profiles/def/generic-profile/geometry-buffer/outputs/result"
        }
      ]
    }
  },
  "source": [
    {
      "title": "OGC 06-103r4 Simple Feature Access - Part 1: Common Architecture, \u00a76.1.23",
      "link": "https://www.ogc.org/standards/sfa/"
    },
    {
      "title": "ISO/IEC 13249-3:2016 Information technology -- Database languages -- SQL multimedia and application packages -- Part 3: Spatial, \u00a75.1.5 ST_Buffer"
    }
  ]
}