{
  "id": "https://geolabs.github.io/bblocks-generic-profiles/def/implementation-profile/union",
  "type": "ImplementationProfile",
  "prefLabel": "Union",
  "definition": "Returns a geometric object representing the point set union of this geometric object with anotherGeometry.",
  "inScheme": "https://geolabs.github.io/bblocks-generic-profiles/def/implementation-profile",
  "status": "submitted",
  "refinesGenericProfile": "https://geolabs.github.io/bblocks-generic-profiles/def/generic-profile/binary-spatial-operation",
  "keywords": [
    "vector",
    "geometry",
    "spatial analysis",
    "set operation",
    "Union",
    "ST_Union"
  ],
  "metadata": [
    {
      "title": "Process Concept: Vector Geometry Processing",
      "role": "http://www.opengis.net/spec/wps/2.0/def/process-profile/concept",
      "href": "https://geolabs.github.io/bblocks-generic-profiles/def/concept/vector-geometry-processing"
    },
    {
      "title": "Generic Profile: Binary spatial set operation",
      "role": "http://www.opengis.net/spec/wps/2.0/def/process-profile/generic",
      "href": "https://geolabs.github.io/bblocks-generic-profiles/def/generic-profile/binary-spatial-operation"
    }
  ],
  "inputs": {
    "geometry1": {
      "id": "https://geolabs.github.io/bblocks-generic-profiles/def/implementation-profile/union/inputs/geometry1",
      "dataType": "https://geolabs.github.io/bblocks-generic-profiles/def/data-type/geometry",
      "schema": {
        "type": "string",
        "contentMediaType": "text/xml",
        "description": "GML"
      },
      "keywords": [
        "geometry",
        "GML"
      ],
      "metadata": [
        {
          "title": "Generic Profile: Binary spatial set operation -- input `geometry1`",
          "role": "https://geolabs.github.io/bblocks-generic-profiles/def/role/generic-input",
          "href": "https://geolabs.github.io/bblocks-generic-profiles/def/generic-profile/binary-spatial-operation/inputs/geometry1"
        }
      ]
    },
    "geometry2": {
      "id": "https://geolabs.github.io/bblocks-generic-profiles/def/implementation-profile/union/inputs/geometry2",
      "dataType": "https://geolabs.github.io/bblocks-generic-profiles/def/data-type/geometry",
      "schema": {
        "type": "string",
        "contentMediaType": "text/xml",
        "description": "GML"
      },
      "keywords": [
        "geometry",
        "GML"
      ],
      "metadata": [
        {
          "title": "Generic Profile: Binary spatial set operation -- input `geometry2`",
          "role": "https://geolabs.github.io/bblocks-generic-profiles/def/role/generic-input",
          "href": "https://geolabs.github.io/bblocks-generic-profiles/def/generic-profile/binary-spatial-operation/inputs/geometry2"
        }
      ]
    }
  },
  "outputs": {
    "result": {
      "id": "https://geolabs.github.io/bblocks-generic-profiles/def/implementation-profile/union/outputs/result",
      "dataType": "https://geolabs.github.io/bblocks-generic-profiles/def/data-type/geometry",
      "schema": {
        "type": "string",
        "contentMediaType": "text/xml",
        "description": "GML"
      },
      "keywords": [
        "geometry",
        "GML"
      ],
      "metadata": [
        {
          "title": "Generic Profile: Binary spatial set operation -- output `result`",
          "role": "https://geolabs.github.io/bblocks-generic-profiles/def/role/generic-output",
          "href": "https://geolabs.github.io/bblocks-generic-profiles/def/generic-profile/binary-spatial-operation/outputs/result"
        }
      ]
    }
  },
  "source": [
    {
      "title": "OGC 06-103r4 Simple Feature Access - Part 1: Common Architecture, \u00a76.1.25",
      "link": "https://www.ogc.org/standards/sfa/"
    },
    {
      "title": "ISO/IEC 13249-3:2016 Information technology -- Database languages -- SQL multimedia and application packages -- Part 3: Spatial, \u00a75.1.53 ST_Union"
    }
  ]
}